Date,Rating,Review,Pros,Cons,Advices,,
13 avr. 2025,5,Terrific experience,"Salary, connections, nature of work","Stress, pressure, complicated work life balance",N/A,,
13 mars 2025,3,"Toxic culture, lots of learnings","The OECD provides ample opportunities to grow professionally, develop expertise, enhance skills and build international networks","The work culture is known to often be rather problematic, problems of harassment are frequent, competition is fierce, job insecurity high","Take the OECD as a stepping stone, protect yourself",,
26 mars 2025,4,Evolving environment,Good salary and nice benefits,Very competitive to get a position,N/A,,
4 mars 2025,3,Fixed term contract,Very diverse and international working environment,"Most positions are based on fixed-term contracts often renewable but the process can take very long.

Recrutement process is also long. Many interviews and tests.",Too much turn over. It would be better to have longer contracts instead.,,
2 mars 2025,2,Temporary Policy Analyst,"Exposure to several policy topics.
Acquaintance with professionals from different backgrounds and countries.
Living in Paris.
Work visa.","Short-term contracts.
Low initial salaries.
Long shifts and tight deadlines.
No benefits.",N/A,,
10 févr. 2025,3,"short-term contracts, strong salary discrepancies with official staff while doing same work","international atmosphere, mostly good working conditions, interesting topics","same job as official staff with close to half the salary, strong salary discrepancies leads to dissatisfaction",N/A,,
2 févr. 2025,4,bon,"Internationale
Interresant 
Renommee
Collegues sympa et qualifié",modalités des contrats pour staff temporaire,N/A,,
7 janv. 2025,5,Excellente expérience,"J'ai pu découvrir l'intégralité des métiers du directorat, y compris dans l'organisation, la rédaction et la communication et m'adapter très rapidement grâce à une super équipe !",Les salaires restent à 700 euros par mois à peu près pour tous les stagiaires.,N/A,,
28 janv. 2025,4,Stimulating,"Competitive High Net Salary, Health Insurance","No bonus, high workload, weird career progression system",N/A,,
22 janv. 2025,4,Bonne experience,Accès à beaucoup d’informations et de ressources.,Système incertain et opaque de postes.,N/A,,
6 janv. 2025,3,Internship,It's the easiest way to enter the organisation,It's not enough to live in Paris,N/A,,
14 déc. 2024,5,Salary OECD,"Good collegues, interesting topics and high wage.",Lots of work and pressure periodically.,N/A,,
5 juil. 2024,1,Organisation toxique,Etre au coeur des enjeux géo-politiques,"1-Très grande précarité. 50% du personnel est en CDD (souvent les postes de grade B et C) mais avec un statut très nettement moins favorable que le droit du travail français. Les autres 50% ont des contrats permanents avec beaucoup d'avantages ce qui crée des distorsions importantes dans les relations de travail.
2- management hautement toxique : aucune importance accordées au management. Des personnes très diplomées ayant un contrat permanent se retrouvent à la tête d'équipes en les traitant comme des ressources corvéables à merci
3- si vous avez des problèmes dans votre travail, ce sera le tribunal administratif de l'OCDE qui tranchera. Comme son nom l'indique, cette instance est à la fois juge et partie. A titre d'exemple, l'ancienne DRH, qui était protégée par le Secrétaire général, a été reconnue coupable de harcèlement sur plusieurs membres de son équipe. Elle a reçu un simple blâme et a été maintenue dans ses fonctions",N/A,,
24 oct. 2024,2,"Plus bureaucratique, tu meurs","Bon salaire, exonéré d’impôts sur les revenus, collègues sympas.","Bureaucracie extrême. Beaucoup de blabla au sujet du bien être du personnel mais en réalité, les quelques efforts ont pour unique but d’éviter des procédures.",N/A,,
15 nov. 2024,4,2 weeks,Networking with an international community,Poor career progression and professional development,NA,,
23 oct. 2024,5,Internship at the OECD,"Relatively well paid compared to other internships in France, real responsibilities, good learning opportunity",Does not necessarily lead to a job,N/A,,
20 févr. 2024,4,"Very good employer, but room for improvement.","Excellent pay and benefits.
Very interesting work.
Very interesting colleagues.","Management skills need improving throughout the organisation, both operations management and people management.
Executive directorate provides sub-standard services to employees, in terms of human resource management, IT services, and facilities.
Dual labour market, with those with tenure often working very little and those on fixed-term contracts doing the bulk of the work.
Very opaque process to decide on who gets tenured, and the process does not seem meritocratic.","Adopt open and transparent recruitment procedures to hire the best talent (use blind psychometric assessments at first stage instead of CVs, blind demographic information on CVs to hiring manager, eliminate panel interviews which have been discredited in the literature - just adopt best practice), abolish dual labour market (use fixed-term contracts only for those on secondment, those substituting people on leave, or for genuinely fixed-term projects; others should be hired on indefinite contracts subject to probation period, and dismissed with just cause, or with indemnity proportional to years of service, when necessary). Make sure that managers have management skills - in operations management and people management.",,
14 oct. 2024,4,Internship,Fine. Very dependent on team.,Very few chances of full time position upon completion.,N/A,,
14 oct. 2024,2,good,"good salary, nice colleagues, nice environment","hierarchical, big structure, high anonymity",N/A,,
22 avr. 2024,2,Intellectually enriching but toxic work culture is widespread,"Intelligence co-workers, interesting work, access to high-level debates, above average salary. Excellent family benefits, as the system is still structured for the 1960s family single breadwinner format. There is even benefits for non-working spouse.","Long hours with no overtime. Short employment contract that leave you vulnerable if you are not an EU citizen. Widespread toxic work culture that values overwork, not taking sick leave and over investing yourself. Managers often have very limited training in managing. Many cases of middle-level staff appropriating work of more junior staff to get promoted. High-turnover of staff. Some team have a better work dynamic, but there is a general contagion effect across most of the departments. It is also a very difficult system to enter, like all international organisations.",Do not see high-turnover of staff as a KPI.,,
22 sept. 2024,4,Overall experience,"Great team, interesting work, great salary and benefits (if staff)","Slow and long internal processes, non-staff contracts with much less benefits",N/A,,
26 sept. 2024,4,Good,Good Good Good Good Good,contract contract contract contract contract,N/A,,
10 sept. 2024,4,Salary analyst,"Travel, data availability and international environment","Management, working hours and promotions",N/A,,
7 sept. 2024,3,Policy Analyst,Good company and good opportunities,"Very good, but sometimes lack of organiation",N/A,,
13 juil. 2024,2,Bullying,"Salary , Location, Coworkers, Multicultural, healthcare","Bullying is left unaddressed 
Old staff who have been there for years are left to treat people extremely badly
Lack of job security, no CDI",N/A,,
3 août 2024,3,oui,"interntional, netowrking, bright people, stimulating works","hierarchical, political, slow, senior staff difficult",N/A,,
11 mai 2024,4,"Great place to work, but poor conditions as a temporary staff","Meaningful
Great colleagues
Top of your field in public policy
Networking opportunities
Small teams
Varied tasks","In general:
- Bureaucratic
- Favouritism / lack of meritocratic career growth
- Political
- Managers’ competence and quality is very variable

For temporary staff specifically:
- much lower salaries compared to official staff
- potential to be exploited 
- general lack of support from managers and the staff association",N/A,,
17 mars 2024,5,stage 7 mois (octobre-mai),"- teletravail 2x per week
- felt comfortable to work in the team, good and prestigious environment (good balance between work and personal life)
- many interns, good to network
- possibility to extend contract (up to 12 months, but depends on department)","- OECD doesnt refund 50% of transport costs (Navigo)
- rémunération is very low for Paris standards (1k per month)
- cantine is abnormally expensive 
- little to no possibility of continuing to work full-time afterwards (depends on department)",N/A,,
27 avr. 2024,3,"Interesting work, frustrating career structure and progression","Interesting work, Good place to build analytical skills and gain experience on policy work.",Workplace environment depends on the team. Very low advantages of being temporary staff. Career system is structured in a way that makes progression difficult and stability almost impossible.,N/A,,
29 mars 2024,5,Good experience,Diversity of nationalities + interest of projects and initiatives,Sometimes the context gets too political where it is not always necessary,There is a need to encourage internal promotion and exchanges of staff between Directorates,,
11 avr. 2024,5,Tres bien,"- horaires raisonable, management sympa, boulot tres interessant","- system pas transparent, pas de visibilite sur le futur",changez entierement de system,,
8 janv. 2024,3,Temporary staff are not fairly compensated,"Interesting subjects, well-regarded institution, junior staff usually very implicated in high-level projects.",No job security for the first 5+ years of your career. Process of advancing in the organisation is opaque and unnecessarily complex. Temporary staff are paid half as much as officials for the same roles and responsibilities.,N/A,,
14 mars 2024,4,Top!!,Très bonne première expérience je recommande,Une hiérarchie assez importante qui écrase la prise d’initiative etc.,N/A,,
15 avr. 2024,1,A fuire...,C'est un salaire important par rapport au moyen national.,Mauvaise ambiance au travail et bcp de problemes d'harcelement et comportement inapproprie.,N/A,,
7 nov. 2023,5,Great international setting and excellent first work experience,"An international organisation that delivers high quality work with real impact for the member and non-member countries. Excellent international setting, stimulating work environment.","As a temporary staff, a 2 year limit is set for working at the organisation. After 2 years, a 6 month break is obligatory before being able to be reemployed again as a temporary staff.",N/A,,
11 févr. 2024,3,Interessant,"International, sujets intéressants, diversité de profils",Dichotomie marquée entre CDD et CDI source de stress,N/A,,
22 déc. 2023,5,Intern,Monthly stipend for students finishing their masters or bachelors,"No other advantages inlcuding, transport, metro card etc.",N/A,,
12 déc. 2023,3,"Environnement de travail correct, mais besoin d'amélioration à plusieurs niveaux",Équilibre vie professionnelle vie privée,Difficulté à évoluer lorsqu'on occuper un poste en assistanat.,N/A,,
14 févr. 2024,1,Cage dorée,"Salaires élevés, télétravail, flexibilté, jours de congés plus élévés","Management à l'américaine. 
CDD à répétition
0 avantages",N/A,,
4 nov. 2023,2,Burn out culture,Salary and international environment and colleagues,Bad management High workload No supervision,N/A,,
11 août 2023,2,exploitation of overqualified employees,"Interesting material and working with colleagues from around the world, very diverse environment","too hieararchical, most high up and well-paid positions are held by white men; very ageist, very sexist; once inside oranisation there is not a lot of room for career growth",N/A,,
17 sept. 2023,5,Très bonne boite,Très bonne boite. Prend soin de ses employés,Horaires très flexibles. vous pouvez travailler tard,N/A,,
5 sept. 2023,4,Bien,"Environnement multiculturel et stimulant, salaires intéressants","Large staff, charge de travail, heures sup non payées",N/A,,
15 juil. 2023,2,Des avantages et inconvénients,"Intérêt de la mission, interlocuteurs internationaux",culture d'organisation archaïque qui ne laisse pas la place à l'expression des individus et les enferme dans des rôles qu'ils ne souhaitent pas,se former au management,,
5 juil. 2023,4,Organisation aux missions intéressantes malgré un fonctionnement bureaucratique,Très bon salaire (pour les administrateurs principaux). Environnement multiculturel et stimulant intellectuellement. Mobilité interne encouragée.,Contrats souvent courts créant grande incertitude. Grande bureaucratie avec fonctionnement très vertical.,N/A,,
13 juin 2023,2,Extraordinarily bureaucratic and hierarchical,"High salary, friendly colleagues, good mutuelle.","Extremely bureaucratic and hierarchical. Total lack of long-term job security (unless you’ve been « converted »), long working hours plus lots of unpaid overtime.",Follow the oecd’s own recommendations on employee well-being.,,
25 mai 2023,2,NO,Very interesting environment: working with various nationalities. Salary for the officials only,"everything else. Bad atmosphere, no HR's. The middle management is horrible: lack of consideration, no empathy... Support staff stick to this work as it tax free and the salary is quite good.",N/A,,
5 avr. 2023,4,positif,"équipe sympa, sujets interessants, bon cadre de travail",conditions de travail compliquées pour les consultants externes,N/A,,
26 juil. 2022,4,OECD is a good employer only if you are hired as official,"You have great working conditions when you are hired as an official. However, contracts usually last 1-2 years until ""conversion"". Conversion is an assessment process carried out after 5 years of being official. Once you are ""converted"", you finally get a CDI. Benefits are even greater if you are ex-pat","Working conditions for non-officials (consultants, external consultants and interns) are quite bad. Many salaries are under the french labour market and contracts are short (6 months, one year, maximum 2 years)",N/A,,
15 févr. 2023,3,Trainee,Lot of opportunities and lessons for a beginner,"Hierarchy, generalist rather than a specialist",N/A,,
11 oct. 2022,2,Don't work here,"Pros: 
Decent salary for France
salary is tax free
great benefits, great healthcare","Cons: 
Horrible work culture
nothing every gets done 
pointless meetings
too many middle managers
pointless objects and HR harassment 
the inner workings of the organisation are too political
the organisation exists just to exist
""better policies for better lives"" is a joke
employee benefits keep getting slashed (but not for the higher-ups)",N/A,,
19 janv. 2023,4,"Bonne organisation, peu de stabilité","Bon salaire, collègues intéressants, horaires corrects.",Manque de stabilité sur le long terme.,N/A,,
10 janv. 2023,3,Bonne expérience mais ...,multiculturel -- environnement riche -- environnement de qualité --,situation très précaire en début de carrière,N/A,,
7 sept. 2022,4,Multi-cultural experience,"Multi-cultural, working with highly skilled, intelligent staff, feeling that our work makes a positive difference in the world, nice offices, decent salary.",Very opaque HR policies, no long term contracts, contract conversion not frequent nor merit-based,PDG pas à jour - C'est aujourd'hui Mathias Cormann
19 août 2022,2,"Bad management, big turnover","Extremely nice people, well educated, multi-cultural environment, good salaries, beautiful and comfortable offices","No real HR inside the departments, nobody will take care of conflicts or internal communication issues, very bad management, lack of leadership and direction, a lot of people constantly on sick leave.",N/A,,
24 oct. 2022,5,Great place to work,Great place to work in Paris,Hard to get the job,N/A,,
23 août 2022,5,Economist,"Challenging and motivating environment, professional, friendly and respectful. Great place to work.","The city of Paris (overly priced everything, messy, dirty, bad service everywhere, no decent infrastructure, over populated).",N/A,,
4 oct. 2022,4,Nice,Nice international environment and great work content.,good place overall but some times short/uncertain contracts,`,,
3 oct. 2022,4,Fuiur,"Bonne ambiance, Bonne équipe , Chaleureux , conviviale , patient","Trop long, Physique, pas à l’écoute",N/A,,
9 sept. 2022,4,Excellente expérience,"Environnement international
Grande expertise des employés
Constant apprentissage
Portefeuille ambitieux et interessant
Equipe motivees, esprit d’équipe",L’organisation pourrait bénéficier d’une plus grande coordination entre les différents directorats,N/A,,
4 sept. 2022,4,Pas facile tous les jours mais on apprend beaucoup,"Bonne équipe, bons avantages, possibilités de télétravailler",Peu de possibilités d'évolution. Managers peu motivants.,N/A,,
8 sept. 2022,4,,"Environnement estimulante, mutuelle, et des opportunités de training.",Contrats à durée très courte (environ 6 mois),N/A,,
15 août 2022,4,Excelente experience,"Bons bénéfices, excellente expérience pour avancer sa carrière","Bureaucratique, politique et il peut y avoir des personnalités difficiles et compétitives",N/A,,
19 nov. 2022,1,Good,Heavy networking. Pushing your future career.,Administrative tasks. Not many things to do.,N/A,,
7 août 2022,3,Human ressources assistant,"The salary for official staff is quite good
Flexibility 
International environnement","The type of contracts 
Stress",N/A,,
9 juin 2022,3,Interesting environment but improvement needed,"+International environment
+Possibility to interact with experts from various fields
+Tax free salaries
+Benefits","-Old structure, HR policies still from 1960's, reform difficult
-The contractual model causes uncertainty and stress, affects the general atmosphere
-Lot of management issues, many incompetent team managers around. Depends on each directorate and team of course.
-Too much work, pressure to meet tight deadlines","More effort needed on selection/training of managers, and wellbeing of current staff.",,
22 juin 2021,5,International et multiculturel,"Culture véritablement internationale, multiculturelle, nombreuses personnes brillantes et intéressantes. Volumes de travail parfois élevé mais respect d'horaires permettant équilibre de vie.","Avant 5 années, contrats à durée fixe (1,2,3 ans) renouvelables. La ""conversion"" en indéterminé après 5 ans est loin d'être automatique, ce qui peut donner quelque pression ou sentiment précaire du point de vue français par exemple, comparé au marché local.",N/A,,
4 juil. 2019,1,Attention Danger,"Travail intéressant, en anglais, brassage des cultures","Aucune politique RH, pas de protection des salariés, outils informatiques (au niveau budget en particulier) dépassés, charge de travail énorme, pas de perspective d'évolution de carrière ou de salaire, pas de management, organisation très politique et népotique, statuts salariés remis en question....","Lancer une vraie politique RH, mettre en pratique les conseils donnés aux pays membres, faire entrer l'organisation dans le 21e siècle concernant les conditions de travail, le respect du salarié, l'équilibre travail-vie perso, les outils informatiques, et réaliser des audits réguliers...",,
9 févr. 2016,4,L'une de mes meilleures expériences en stage,"Très international, beaux locaux, équipes diversifiées et professionnelles. Beaucoup d'activités ad hoc et possibilité de rencontrer beaucoup de personnes intéressantes. Beaucoup de grandes personnalités traversent parfois les couloirs !",Les stagiaires sont bien souvent payés au strict minimum. Cela pourrait être discriminant pour les étudiants étrangers n'ayant pas assez de moyen pour louer un logement à Paris même.,N/A,,
20 juin 2017,5,Excellent,"Tres enrichissant, beaucoup de personne motives et cutives au sein de l'organisation. Un service irreprochable.",Un manque d'energie de temps en temps. Les employes ont l'air endormits par les hauts salaires et le manque d'innovation et de constante creativite.,"Motives la population du lieux, plus investissement en politique afin d'insciter les gens a s'interesse et a s'engager.",,
3 oct. 2018,2,ok pour une première expérience mais il faut pas y rester pour très longtemps,"Salaire, salaire, salaire, salaire, salaire, salaire",Organisation très corrompue et pas du tout méritocratique, bcp de copinage, tâches répétitives et ambiance pas très intellectuellement stimulante,Il est temps de partir!
17 oct. 2018,4,L'art de l'influence,"Salaire confortable, équipes plus ou moins diversifiées selon les projets et les directions, flexibilité du temps de travail",Une politique managériale qui se cherche encore et une grande séparation (physique et comportementale) entre le personnel junior et le personnel senior,N/A,,
19 mars 2015,3,"Environnement stimulant, évolution difficile","Environnement multiculturel, analystes pointus dans leur domaine, possibilité d'assister à des conférences de haut niveau.","Grandes différences de rémunération et de durée de contrat entre les consultants et le staff permanent, évolution vers des postes permanents très limitée.",N/A,,
5 mai 2018,4,Conditions de travail,Cadre de travail adéquat et très stimulant.,Difficultés à proposer des CDI aux employés,Mobiliser des ressources financières durables pour mieux retenir les employés.,,
11 sept. 2019,4,Globalement positif,"Très bon salaire, collègues sympas et intéressants.","Contrats courts, difficulté de progresser.","Mettre en place un meilleur système pour progresser dans sa carrière, sous risque de voir beaucoup de personnes quitter l'OCDE pour des emplois plus stables.",,
29 nov. 2021,1,"Do what I say, not what I do","Salaires autrefois généreux, mais moins aujourd'hui","cette institution ne veut pas garder les gens plus de 5 ans, au risque de se créer des obligation de long-terme (droit à pension). Elle épuisera vos compétences, vous fera miroiter un avenir LT, et vous jetera dans les pires moments (en cours de congé-maladie, pendant un congé parental...).","soyez avec l'OCDE, aussi cynique que l'organisation est avec vous...",,
19 juin 2020,4,Une bureaucratie mais une formidable organisation,"Une ambiance jeune, dynamique, internationale. D'excellentes conditions de travail. Des bons salaires. Des sujets intéressants.","Des processus administratifs complexes, un système de ressources humaines en révision car problématique. Souvent stressant.",N/A,,
6 mars 2019,4,Intellectuellement stimulant,"Entourage professionnel très compétent et qualifié
Environnement de travail agréable
Séminaires internationaux","Conditions contractuelles pour les consultants 
Impact de l'organisation sur le développement international questionnable
Usine à rapports",N/A,,
28 avr. 2018,2,beaucoup trop de précarité,Les rémunérations sont relativement élevées,"50% du personnel est en CDD, très fort niveau de turn-over et management à court-terme",N/A,,
23 nov. 2017,2,it used to be...,salaire et lieu de travail,cette institution n'est pas gérée et l'arbitraire y règne...,appliquez ce que vous prêchez.,,
4 juin 2019,5,Très bonne expérience,"Rémunération attractive (non soumise à l'impôt sur le revenu)
Organisation (et donc équipes) internationale
Cadre & environnement",Une certaine lenteur dans l'évolution de l'organisation,None.,,
23 nov. 2019,3,Cage doree mais pas de work-life balance,Le salaires non soumise aux impots (si on est embauche en tant qu’officelle),"surcharge de travail, non respet de ton temps, concurrence entre employee",N/A,,
3 févr. 2020,5,Plaque tournante de dynamisme et de meilleures politiques,"Milieu multi-culturel, travailler en plusieurs langues, ouverture sur le monde, sujets variés et passionnants","Difficulté à obtenir un contrat stable, renouvellements de contrats courts trop nombreux",N/A,,
27 oct. 2015,3,Une prison dorée,Salaire exonéré d'impot sur le revenu,"Un manque d'interet certain des divisions de support (RH, IT, etc...)",Le salaire n'est pas le seul facteur de motivation,,
12 juil. 2017,3,Bien,Équipe multiculturelle et rencontres passionnantes,Gestion RH et manque de leadership,N/A,,
17 sept. 2019,5,Très bon endroit,"Ambiance internationale, salaire ok (surtout en début de carrière), possibilité de travailler sur des sujets très divers.","Parfois ça bouge lentement, proche des méthodes de travail d'administrations publiques",N/A,,
18 janv. 2022,5,Bonne organisation où lancer une carrière,"Ouverture à l'internationale, prestige et développement intellectuel",instabilité d'emploi (pas de CDI possible avant au minimum 5 années de service en tant que fonctionnaire international),N/A,,
19 juin 2020,4,Une expérience riche,"Salaire non imposable sur le revenu
Environnement multiculturel et international
Beau cadre (château de la Muette)",Pesanteur inhérente à une Organisation de ce type,N/A,,
26 juin 2022,4,Salaire,"Quelques avantages intéressants. Environnement international, stimulant sur le plan intellectuel.","Peu de possibilités d'évolution. 
Tout dépend de connaissance de bonnes personnes et cercles sociales.",N/A,,
17 déc. 2016,5,Top de la recherche,Dynamisme intellectuel et rencontres passionnantes.,Peu de perspectives d'évolution pour les jeunes diplômés.,Recruter plus de jeunes diplômés.,,
17 août 2020,3,"Belle organisation, ambiance mitigée",International salaire pas d’impôts sur le revenu sujets passionnants,"Beaucoup de collaborateurs frustrés qui ne partent pas car nombreux avantages, ambiance mitigée",N/A,,
