Date,Rating,Review,Pros,Cons,Advices,,
30 mars 2022,3,Avis sur l'OCDE,Une culture internationale et une organisation qui traite des sujets importants de politique publique,Beaucoup de bureaucratie et un certain nombre de personne pas très motivées,N/A,,
29 mai 2019,5,Expérience très positive,"Travail intéressant et stimulant, ambiance internationale, bonne rémunération",Parfois un peu stressant mais comme dans toutes les grandes organisations internationales,N/A,,
24 juin 2019,5,"Bon salaire, bonne ambiance, friendly","salaire, pas d’impot sur le revenu, flexibilité, opportunité d’evoluer",tres « fonctionnaire » puisque c’est une organisation internationale.,N/A,,
28 avr. 2021,4,Une opportunité professionelle,"- Travail difficile 
- Excellent environnement professionelle 
- Opportunité de networking de haut niveau","- Work life balance
- Précarité des contrats",N/A,,
5 sept. 2019,5,Excellente expérience,"Une ambiance multiculturelle, des équipes ultra qualifiées, des projets exaltants",Un environnement trés conccurentiel et un peu trop feutré,N/A,,
14 mai 2022,4,OCDE assistant,"Pay non taxed, good health insurance",Little growth within the assistant brakcet,N/A,,
19 févr. 2021,5,Project manager,"Intérêt intellectuel, diversité des équipes, qualité des locaux, rémunération","Clientélisme, culture très académique et moins d'un do tank.",N/A,,
23 juin 2021,5,Excellente organisation pour développer les talents,Salaires très attractifs et cadre de travail agréable,Pression très importante pour les administrateurs,N/A,,
16 mars 2022,5,Bon cadre de travail,"Environnement de travail dynamique, locaux agréables",Précarité des contrats de consultant,N/A,,
4 avr. 2022,4,très bonnes opportunités,"Rémunération et avantages sociaux, prestige, accès aux réseaux de qualité","Aléas politiques, forte charge de travail.",N/A,,
21 juin 2021,3,Politique des contrats,Organisation internationale multiculturelle très agréable,Politique de contrats de type CDD,Réviser la politique de contrats,,
15 nov. 2021,4,bien,travailler au sein d'une organisation internationale,pas d'avantages ou aides de l'état francais,N/A,,
29 sept. 2021,5,Good place to work,"Flexibility, working environment, International culture and benefits",Sometimes unstable contracts and workload,N/A,,
16 juil. 2022,4,2 weeks,The working environment is great, interesting topics of research,The contracts' lengths are short,N/A,
20 juin 2019,5,Excellent,Très bonne ambiance et bonne rémunération,Rigidité administrative et difficulté des procédures bureaucratiques,N/A,,
1 déc. 2019,3,Conditions,Les sujets de travail et les gens.,"Les heures de travail, competition",N/A,,
30 sept. 2021,4,bonne expérience,"environnement international enrichissant, sujets captivants",durée des contrats parfois inférieurs à 6 mois,N/A,,
6 janv. 2021,3,consultant,possibilité de teletravail et deplacements frequents,lenteur administrative et un fonctionnement tres horizontal,N/A,,
28 févr. 2021,5,Grande visibilité,"Apprentissage, experience, international, developemnt, statistique","Depend du departement, trop analytique",N/A,,
19 oct. 2021,5,Enrichissant,"Réseau, compétences, ambiance, international, impressionnant","Précarité, faible salaire, statut, intense",N/A,,
29 oct. 2018,4,Intéressant,Bonne ambiance et travail intéressant,Je n'ai pas trouve d’inconvénients.,N/A,,
1 juin 2022,2,avis,Flexibility Team-working Topics Diversity Life-balance,Bad management Unfinished missions Long processes,N/A,,
8 oct. 2017,5,Analyste,plusieurs avantages,Pas d'inconvénients,N/A,,
24 nov. 2018,1,To avoid,"Salary, multicultural organization, great city to work","Terrible management
 lacking basic management skills, lack of transparency, recruitment of friends and family, promotion of friends. Some officials have been there for over 25 years, lack of motivation and engagement. Terrible atmosphere. 
The moral harassment from the people who is over 15-25 years on the same position. Despite informing HR, Managemant, Staff association, the work medecine, nobody took into cosideration my problem because the Management have been covering his friends.
Everybody was saying me that unfortenately I was working in the purely French team, the reason of the moral harassment as I am not French.","Please make the audit to check this kind of problems , please stop the moral harassment .",,
5 nov. 2020,3,Coordinateur,ambiance motivante et personnel qualifie,"peu de mobilite possible, sauf si vous avez des ""contacts"" autrement dit, par piston. 
contrats en CDD poussant a la precarite pour les jeunes diplomes",N/A,,
20 août 2018,4,Environment stimulant,Environment international et trés stimulant,pas beaucoup de job offers pour mon secteur,N/A,,
